{
	"contract_id": "CONT-2026-001",
	"title": "Master Services Agreement",
	"parties": ["Acme Corp", "Beta Inc"],
	"contract_type": "MSA",
	"contract_category": "Commercial",
	"source_channel": "file",
	"industry": "Technology",
	"counterparty_type": "vendor-customer",
	"risk_level": "MEDIUM",
	"compliance_needs": ["data_privacy", "procurement_controls"],
	"effective_date": "2026-01-01",
	"expiry_date": "2027-01-01",
	"value": 250000,
	"currency": "USD",
	"jurisdiction": "New York",
	"source_system": null,
	"confidence_score": 0.95
}
